{
  "$id": "https://example.com/podcast.schema.json",
  "$schema": "https://json-schema.org/draft/2020-12/schema",
  "title": "Podcast",
  "type": "object",
  "description": "Podcast JSON Schema",
  "properties": {
    "title": {
      "type": "string"
    },
    "subtitle": {
      "type": "string"
    },
    "description": {
      "type": "string"
    },
    "mail": {
      "type": "string"
    },
    "website": {
      "type": "array",
      "items": {
        "type": "object",
        "properties": {
          "name": {
            "type": "string"
          },
          "description": {
            "type": "string"
          },
          "url": {
            "type": "string"
          }
        }
      }
    }
  }
}